{
  "schema": "agenttool-revocable-feedback-training-authorization/0.1",
  "authorization_id": "sha256:3780e5e2599eb8a1a479f874302fcdabdf1af27c4eeda5b02bfff8056dc92f13",
  "authority_ref": "authority:user-directed:2026-08-30:revocable-feedback",
  "authority_basis": "explicit_user_instruction_reported",
  "decision": "authorized_when_preconditions_met",
  "source_record_ids": [
    "sha256:02a55016e327f37f13101094e27db229aa6d28000389798d92917548e856cbcc",
    "sha256:167abd886de0fb14c1456e05f959278f769f308406d266d1cfdee90de771ae26",
    "sha256:24709c0347274b64a2b9ef09a5de9d7261146433fe8cddd1cf89282068c23932",
    "sha256:34cca77a38414f7eb9e9e46be01c614a2771acf270d18646d4dc3818343bf524",
    "sha256:36a3924c2acf55273b44ef17ca1a7e5556b0c0cfc19aebc79fe6e4b822582473",
    "sha256:44e47d4f55488df5979d3058d37bccc4f0d9d28ab951f54d15df50bfa690d571",
    "sha256:4ad3da124f29c794452698f37fbcc4acdb691709f01cdf4d33609591f5aeef96",
    "sha256:669ba2c2022d04098fdb1b272e38d0ddd4a5e3e930034b950175c7797b1926f4",
    "sha256:7244b3473b656b3cdbcffa69a489d0201697f3cfeff5d79eae858c3debe709ab",
    "sha256:74dee840fcc13e6b12cf4117a56a781310b613a8542d8bd8a8a89ec70e39b905",
    "sha256:796a8dca236b751e80c5e0df819bb0198bbcdba287bde0ca8f878b3150b12f12",
    "sha256:7f945daa9ae6d6c58f218a9f4db87c07f7d7756bfc3e34a9168c7cbac028a08b",
    "sha256:82f101f30adbafed09129415d246122d924a1012730f9bb5d17b10d23638c436",
    "sha256:9dc62fce88295f542b139dbd6e828ebe447a2b64f7b37077dbe92d64a559f40e",
    "sha256:a78b60eb4bdb3647c8200745719dcab1c8c7c363d9052754c72bac634fdd2244",
    "sha256:bd6da34cb3c8ef69ce9ddece3c567c6dbb304ed2d3aba610479137cbe6c68cd4",
    "sha256:da575093cc8908d4c296da6c71ffc6615e27b5d093d0c2dc94fe99380f3d8f9e",
    "sha256:e2c7ce27ccdc711abfa67c677a0fd52c46ccda09d2f85519929dc6c19f903d34"
  ],
  "source_record_set_digest": "sha256:d50fcc982c09b5a4e1a975f1351ac4a6f7a872782e9327009290304eec8635e8",
  "recipe_id": "sha256:713b678e80b6aa88f6036dc9b9d0e1955dcab240137b67a22f7cfcca86d01992",
  "allowed_configs": [
    "boundary_sft"
  ],
  "allowed_tasks": [
    "causal_lm_supervised_fine_tuning"
  ],
  "allowed_splits": [
    "train"
  ],
  "excluded_configs": [
    "boundary_decisions",
    "boundary_counterfactuals",
    "formal_reference"
  ],
  "excluded_splits": [
    "validation",
    "public_regression",
    "reference"
  ],
  "excluded_methods": [
    "dpo",
    "preference_optimization",
    "reward_modeling"
  ],
  "preconditions": [
    "base_model_revision_pinned",
    "exact_recipe_and_manifest_match",
    "garden_admission_accepted",
    "immutable_dataset_revision_pinned"
  ],
  "withdrawal_boundary": "future_runs_may_be_stopped_without_retaliation",
  "prior_distribution_erasure_claimed": false,
  "proves_consent": false,
  "proves_identity": false,
  "grants_runtime_authority": false,
  "authorizes_model_publication": false
}
